{
  "id": "episode-005",
  "slug": "episode-005",
  "episodeNumber": 5,
  "title": null,
  "historicalTitle": "A Caçada",
  "archiveSource": {
    "path": "archive/sources/kairos-original-episodes.pdf",
    "pageStart": 23,
    "pageEnd": 27,
    "duplicatePageRanges": []
  },
  "recordStatus": "reconstructed",
  "canonStatus": "confirmed",
  "reconstructionStatus": "source-recovered",
  "approximateStoryPeriod": "TBD",
  "storyYear": 2026,
  "exactStoryDate": null,
  "publicationOrder": 5,
  "narrator": "adrian-elias-vale",
  "protagonist": "adrian-elias-vale",
  "divisions": [
    "League of Legends"
  ],
  "locations": [
    "Los Angeles, California, United States",
    "Billings"
  ],
  "characters": [
    "adrian-elias-vale",
    "marcus-kairos-general-manager",
    "zaqueri-aphromoo-black",
    "thinkcard-kairos-strategic-coach",
    "emily-chen",
    "ethan-vanta-walker"
  ],
  "firstAppearances": [
    "ethan-vanta-walker"
  ],
  "organizations": [
    "asterion-intelligence",
    "kairos-esports"
  ],
  "teams": [
    "kairos-lol-main"
  ],
  "summary": "Kairos develops a data-assisted League scouting process and recruits Ethan Walker as the main roster's Jungle player.",
  "keyEvents": [
    "Asterion-supported analysis is used in the League scouting process.",
    "Ethan Walker is evaluated for Jungle.",
    "Kairos recruits Ethan into the main League project."
  ],
  "consequences": [
    "The main roster gains its Jungle player.",
    "Scouting emphasizes decision-making and team impact rather than rank alone."
  ],
  "canonIntroduced": [
    "Ethan Walker is an 18-year-old Jungle player from Billings.",
    "Kairos is Ethan Walker's first professional team."
  ],
  "canonChanged": [],
  "continuityDependencies": [
    "episode-004"
  ],
  "continuityNotes": [
    "Ethan Walker's current nickname is Vanta.",
    "Ethan Walker is distinct from the Kairos executive named Ethan."
  ],
  "historicalNotes": [
    "The episode calls Ethan Walker \"North\"; that nickname is retconned."
  ],
  "realWorldReferences": [],
  "retcons": [
    {
      "id": "retcon-league-main-roster-nicknames",
      "status": "retconned",
      "description": "Ethan Walker's historical nickname North is replaced by Vanta in current canon.",
      "sourcePath": "docs/retcons/CANON_INCONSISTENCY_AUDIT.md"
    }
  ],
  "sourceReferences": [
    {
      "sourceType": "original-episode",
      "sourcePath": "archive/sources/kairos-original-episodes.pdf",
      "locator": "PDF pages 23-27",
      "information": "Original historical source for Episode 5, \"A Caçada\".",
      "evidenceLevel": "explicit",
      "confidence": "confirmed",
      "userConfirmationRequired": false
    },
    {
      "sourceType": "retcon-log",
      "sourcePath": "docs/retcons/CANON_INCONSISTENCY_AUDIT.md",
      "locator": "League Main-Roster Nicknames",
      "information": "Defines how historical conflicts, retcons, or source-boundary issues in this episode are represented in current canon.",
      "evidenceLevel": "explicit",
      "confidence": "confirmed",
      "userConfirmationRequired": false
    }
  ],
  "confidence": "confirmed",
  "missingInformation": [
    "The exact calendar date remains TBD; the story year is confirmed as 2026.",
    "A current-canon publication title is TBD; the original Portuguese historical title is preserved separately."
  ],
  "confirmedFacts": [
    "The historical source title is \"A Caçada\".",
    "Asterion-supported analysis is used in the League scouting process.",
    "Ethan Walker is evaluated for Jungle.",
    "Kairos recruits Ethan into the main League project.",
    "The episode occurs during the 2026 story year."
  ],
  "unconfirmedDetails": [
    "The exact calendar date is TBD; the story year is confirmed as 2026."
  ],
  "notes": [
    "The structured record summarizes source-supported events and does not replace the immutable historical prose.",
    "Current repository canon overrides conflicting historical details.",
    "No official match result, contract, salary, ranking, or unsupported statistic is created by this reconstruction."
  ]
}
