{
  "id": "episode-033",
  "slug": "episode-033",
  "episodeNumber": 33,
  "title": "Dois Caminhos",
  "historicalTitle": "TBD",
  "archiveSource": null,
  "recordStatus": "reconstructed",
  "canonStatus": "confirmed",
  "reconstructionStatus": "source-recovered",
  "approximateStoryPeriod": "late-october-2026",
  "storyYear": 2026,
  "exactStoryDate": null,
  "publicationOrder": 33,
  "narrator": "adrian-elias-vale",
  "protagonist": "adrian-elias-vale",
  "divisions": ["Counter-Strike"],
  "locations": ["Kairos campus, Los Angeles, California"],
  "characters": [
    "adrian-elias-vale",
    "lukas-luk-novak",
    "ethan-trace-miller",
    "emily-chen",
    "caleb-atlas-mercer",
    "owen-glacier-fletcher"
  ],
  "firstAppearances": ["owen-glacier-fletcher"],
  "organizations": ["kairos-esports"],
  "teams": ["kairos-cs-main"],
  "summary": "Kairos continues Caleb's IGL evaluation while Owen Fletcher emerges as the primary AWPer candidate.",
  "keyEvents": [
    "Owen Fletcher makes his first canonical appearance in the scouting process.",
    "The staff compares the leadership search with the separate AWPer search.",
    "Caleb is identified as an 18-year-old left-handed IGL from Silver City, New Mexico, and a former Rifler.",
    "Owen is identified as a 18-year-old AWPer from Mackenzie, British Columbia.",
    "Adrian decides to travel personally to meet Owen."
  ],
  "consequences": [
    "Owen becomes the primary AWPer candidate and remains unsigned."
  ],
  "canonIntroduced": [
    "Owen Fletcher first appears as a Counter-Strike AWPer prospect."
  ],
  "canonChanged": [],
  "continuityDependencies": ["episode-032"],
  "continuityNotes": [
    "The normalized source preserves first-person narration by Adrian Vale.",
    "No official competitive debut has occurred."
  ],
  "historicalNotes": [
    "This episode is outside the immutable Episodes 1-29 historical PDF.",
    "The searchable normalized source records approved identity and continuity corrections.",
    "The source's age-16 claim for Owen is superseded by his confirmed 2007-12-02 birth date; current canon makes him 18 during Episode 33."
  ],
  "realWorldReferences": ["Astralis", "FaZe Clan and karrigan", "Team Liquid"],
  "retcons": [
    {
      "id": "retcon-owen-fletcher-age",
      "status": "retconned",
      "description": "The source age of 16 is superseded by Owen Fletcher's confirmed 2007-12-02 birth date and age 18.",
      "sourcePath": "docs/retcons/RETCON_HISTORY.md"
    }
  ],
  "sourceReferences": [
    {
      "sourceType": "original-episode",
      "sourcePath": "docs/episodes/sources/KAIROS_EPISODES_030_056_NORMALIZED.md",
      "locator": "Episódio 33 — Dois Caminhos",
      "information": "Supplies the normalized episode prose, chronology, participants, and canonical events.",
      "evidenceLevel": "explicit",
      "confidence": "confirmed",
      "userConfirmationRequired": false
    }
  ],
  "confidence": "confirmed",
  "missingInformation": ["The exact calendar date is TBD."],
  "confirmedFacts": [
    "The canonical title is \"Dois Caminhos\".",
    "Owen Fletcher makes his first canonical appearance in the scouting process.",
    "The staff compares the leadership search with the separate AWPer search.",
    "Caleb is identified as an 18-year-old left-handed IGL from Silver City, New Mexico, and a former Rifler.",
    "Owen is identified as a 18-year-old AWPer from Mackenzie, British Columbia.",
    "Adrian decides to travel personally to meet Owen.",
    "Caleb Mercer and Owen Fletcher are identified as the prospects later known as Atlas and Glacier."
  ],
  "unconfirmedDetails": ["The exact calendar date is TBD."],
  "notes": [
    "The approved prose remains in the normalized source file and is not duplicated here.",
    "No unsupported result, statistic, salary, ranking, or contract term was added."
  ]
}
