{
  "id": "episode-038",
  "slug": "episode-038",
  "episodeNumber": 38,
  "title": "O Primeiro Convite",
  "historicalTitle": "TBD",
  "archiveSource": null,
  "recordStatus": "reconstructed",
  "canonStatus": "confirmed",
  "reconstructionStatus": "source-recovered",
  "approximateStoryPeriod": "late-october-2026",
  "storyYear": 2026,
  "exactStoryDate": null,
  "publicationOrder": 38,
  "narrator": "adrian-elias-vale",
  "protagonist": "adrian-elias-vale",
  "divisions": ["Counter-Strike", "League of Legends"],
  "locations": ["Kairos campus, Los Angeles, California"],
  "characters": [
    "adrian-elias-vale",
    "lukas-luk-novak",
    "ethan-trace-miller",
    "emily-chen",
    "zaqueri-aphromoo-black",
    "caleb-atlas-mercer",
    "owen-glacier-fletcher",
    "cameron-mold-ruiz"
  ],
  "firstAppearances": ["cameron-mold-ruiz"],
  "organizations": ["kairos-esports"],
  "teams": ["kairos-cs-main", "kairos-lol-main"],
  "summary": "Adrian and Luk return to Los Angeles, Kairos reviews Owen's candidacy, and Cameron Ruiz, known as Mold, enters the scouting record.",
  "keyEvents": [
    "Adrian and Luk return to the Kairos campus after meeting Owen and Arthur in Mackenzie.",
    "Kairos reviews Owen's candidacy after extending the evaluation invitation in Episode 37.",
    "Cameron Ruiz and the nickname Mold make their first canonical appearance.",
    "No invitation is issued to Cameron.",
    "Cameron is 18, lives in Truth or Consequences, New Mexico, works part-time as a mechanic, and plays Entry."
  ],
  "consequences": [
    "Owen remains invited to a non-binding three-week evaluation.",
    "Cameron remains an unsigned scouted prospect."
  ],
  "canonIntroduced": [
    "Cameron Ruiz first appears as Mold, an Entry prospect and part-time mechanic."
  ],
  "canonChanged": [],
  "continuityDependencies": ["episode-037"],
  "continuityNotes": [
    "The normalized source preserves first-person narration by Adrian Vale.",
    "No official competitive debut has occurred."
  ],
  "historicalNotes": [
    "This episode is outside the immutable Episodes 1-29 historical PDF.",
    "The searchable normalized source records approved identity and continuity corrections.",
    "The source's age-19 claim for Cameron is superseded by his confirmed 2008-01-11 birth date; current canon makes him 18 during Episode 38."
  ],
  "realWorldReferences": [],
  "retcons": [
    {
      "id": "retcon-cameron-ruiz-age",
      "status": "retconned",
      "description": "The source age of 19 is superseded by Cameron Ruiz's confirmed 2008-01-11 birth date and age 18.",
      "sourcePath": "docs/retcons/RETCON_HISTORY.md"
    }
  ],
  "sourceReferences": [
    {
      "sourceType": "original-episode",
      "sourcePath": "docs/episodes/sources/KAIROS_EPISODES_030_056_NORMALIZED.md",
      "locator": "Episódio 38 — O Primeiro Convite",
      "information": "Supplies the normalized episode prose, chronology, participants, and canonical events.",
      "evidenceLevel": "explicit",
      "confidence": "confirmed",
      "userConfirmationRequired": false
    }
  ],
  "confidence": "confirmed",
  "missingInformation": ["The exact calendar date is TBD."],
  "confirmedFacts": [
    "The canonical title is \"O Primeiro Convite\".",
    "Adrian and Luk return to Los Angeles after meeting Owen and Arthur.",
    "Owen's non-binding three-week evaluation invitation was extended in Episode 37.",
    "Cameron Ruiz and the nickname Mold make their first canonical appearance.",
    "No invitation is issued to Cameron.",
    "Cameron is 18, lives in Truth or Consequences, New Mexico, works part-time as a mechanic, and plays Entry.",
    "Cameron's previous age-19 claim is retconned; he is 18 at this point in the story."
  ],
  "unconfirmedDetails": ["The exact calendar date is TBD."],
  "notes": [
    "The approved prose remains in the normalized source file and is not duplicated here.",
    "No unsupported result, statistic, salary, ranking, or contract term was added."
  ]
}
